{
    "meta": {
        "protocol_version": "1.0.0",
        "schema_version": "1.0.0",
        "created_at": "2025-01-01T00:00:00.000Z"
    },
    "context_id": "550e8400-e29b-41d4-a716-446655440000",
    "root": {
        "domain": "golden-test",
        "environment": "test"
    },
    "title": "Basic Planning Flow",
    "status": "active"
}