{
  "meta": {
    "protocol_version": "1.0.0",
    "schema_version": "1.0.0",
    "created_at": "2025-11-29T10:00:00.000Z"
  },
  "context_id": "550e8400-e29b-41d4-a716-446655440200",
  "title": "Large-Scale OAuth 2.0 + JWT Migration",
  "root": {
    "domain": "golden-test",
    "environment": "test"
  },
  "status": "active"
}
