{
    "meta": {
        "protocol_version": "1.0.0",
        "schema_version": "1.0.0",
        "created_at": "2025-11-30T12:15:00.000Z"
    },
    "context_id": "650e8400-e29b-41d4-a716-446655444000",
    "root": {
        "domain": "map-broadcast-demo",
        "environment": "test"
    },
    "title": "MAP Broadcast Fan-out Demo",
    "status": "active"
}