{
    "meta": {
        "protocol_version": "1.0.0",
        "schema_version": "1.0.0",
        "created_at": "2025-11-30T12:05:00.000Z"
    },
    "context_id": "550e8400-e29b-41d4-a716-446655442000",
    "root": {
        "domain": "sa-step-evaluation",
        "environment": "test"
    },
    "title": "SA Multi-Step Evaluation Demo",
    "status": "active"
}