{
    "meta": {
        "protocol_version": "1.0.0",
        "schema_version": "1.0.0",
        "created_at": "2025-11-30T12:00:00.000Z"
    },
    "context_id": "550e8400-e29b-41d4-a716-446655441000",
    "root": {
        "domain": "sa-profile-demo",
        "environment": "test"
    },
    "title": "SA Basic Execution Demo",
    "status": "active"
}